<?xml version="1.0" encoding="UTF-8" standalone="yes"?>
<dozentenliste xmlns:xsi="http://www.w3.org/2001/XMLSchema-instance" xsi:schemaLocation="http://example.org/dozent ../xmlUxsd/dozentenliste.xsd">
    <dEintrag dozentId="1">
        <name>Prof. Dr. Kristian Fischer</name>
    </dEintrag>
    <dEintrag dozentId="2">
        <name>Prof. Dr. rer. nat. Wolfgang Konen</name>
    </dEintrag>
    <dEintrag dozentId="3">
        <name>Prof. Dr. Horst Stenzel</name>
    </dEintrag>
    <dEintrag dozentId="4">
        <name>Prof. Dipl. Des. Christian Noss</name>
    </dEintrag>
</dozentenliste>
